{
  "label_scope": "visual_similarity_only",
  "pack_id": "vlp_1fde2adcdc33638351bb",
  "pair_count": 200,
  "pairs": [
    {
      "annotation": {
        "annotator_id": null,
        "confidence": null,
        "notes": null,
        "visual_similarity": null
      },
      "frozen": false,
      "left": {
        "image_key": "4020220164027.png"
      },
      "pair_id": "vp_00ebbab65608ee1a220a",
      "right": {
        "image_key": "4020250027521.png"
      },
      "split": "dev"
    },
    {
      "annotation": {
        "annotator_id": null,
        "confidence": null,
        "notes": null,
        "visual_similarity": null
      },
      "frozen": false,
      "left": {
        "image_key": "4020220164027.png"
      },
      "pair_id": "vp_01bf33256660f16e997d",
      "right": {
        "image_key": "4020240047157.png"
      },
      "split": "dev"
    },
    {
      "annotation": {
        "annotator_id": null,
        "confidence": null,
        "notes": null,
        "visual_similarity": null
      },
      "frozen": false,
      "left": {
        "image_key": "4020240047157.png"
      },
      "pair_id": "vp_02c0a98e208a6031152a",
      "right": {
        "image_key": "4020240227309.png"
      },
      "split": "dev"
    },
    {
      "annotation": {
        "annotator_id": null,
        "confidence": null,
        "notes": null,
        "visual_similarity": null
      },
      "frozen": false,
      "left": {
        "image_key": "4020240047157.png"
      },
      "pair_id": "vp_02e9a3ba6f915e2a23e8",
      "right": {
        "image_key": "4020250020562.png"
      },
      "split": "dev"
    },
    {
      "annotation": {
        "annotator_id": null,
        "confidence": null,
        "notes": null,
        "visual_similarity": null
      },
      "frozen": true,
      "left": {
        "image_key": "4020220173357.png"
      },
      "pair_id": "vp_037f0a0c6611d242a393",
      "right": {
        "image_key": "4020240147524.png"
      },
      "split": "frozen_holdout"
    },
    {
      "annotation": {
        "annotator_id": null,
        "confidence": null,
        "notes": null,
        "visual_similarity": null
      },
      "frozen": false,
      "left": {
        "image_key": "4020210070072.png"
      },
      "pair_id": "vp_05094a7066eea945f192",
      "right": {
        "image_key": "4020260026077.png"
      },
      "split": "dev"
    },
    {
      "annotation": {
        "annotator_id": null,
        "confidence": null,
        "notes": null,
        "visual_similarity": null
      },
      "frozen": false,
      "left": {
        "image_key": "4020220164027.png"
      },
      "pair_id": "vp_05a9589778b8b3eddfb9",
      "right": {
        "image_key": "4020240227309.png"
      },
      "split": "dev"
    },
    {
      "annotation": {
        "annotator_id": null,
        "confidence": null,
        "notes": null,
        "visual_similarity": null
      },
      "frozen": true,
      "left": {
        "image_key": "4020230104392.png"
      },
      "pair_id": "vp_06e53a0d7c5ab837809e",
      "right": {
        "image_key": "4020250133645.png"
      },
      "split": "frozen_holdout"
    },
    {
      "annotation": {
        "annotator_id": null,
        "confidence": null,
        "notes": null,
        "visual_similarity": null
      },
      "frozen": false,
      "left": {
        "image_key": "4020210070072.png"
      },
      "pair_id": "vp_07440d724aedaae82a6f",
      "right": {
        "image_key": "4020250034709.png"
      },
      "split": "dev"
    },
    {
      "annotation": {
        "annotator_id": null,
        "confidence": null,
        "notes": null,
        "visual_similarity": null
      },
      "frozen": false,
      "left": {
        "image_key": "4020240227309.png"
      },
      "pair_id": "vp_07a3a529d7e1eb370f48",
      "right": {
        "image_key": "4020250229515.png"
      },
      "split": "dev"
    },
    {
      "annotation": {
        "annotator_id": null,
        "confidence": null,
        "notes": null,
        "visual_similarity": null
      },
      "frozen": true,
      "left": {
        "image_key": "4020220164027.png"
      },
      "pair_id": "vp_07a4424d9240fa45a258",
      "right": {
        "image_key": "4020240217822.png"
      },
      "split": "frozen_holdout"
    },
    {
      "annotation": {
        "annotator_id": null,
        "confidence": null,
        "notes": null,
        "visual_similarity": null
      },
      "frozen": false,
      "left": {
        "image_key": "4020230088952.png"
      },
      "pair_id": "vp_07ec16b2b6cca34aac95",
      "right": {
        "image_key": "4020250133645.png"
      },
      "split": "dev"
    },
    {
      "annotation": {
        "annotator_id": null,
        "confidence": null,
        "notes": null,
        "visual_similarity": null
      },
      "frozen": false,
      "left": {
        "image_key": "4020240217822.png"
      },
      "pair_id": "vp_09f7fa0c371ca73653fe",
      "right": {
        "image_key": "4020250020562.png"
      },
      "split": "dev"
    },
    {
      "annotation": {
        "annotator_id": null,
        "confidence": null,
        "notes": null,
        "visual_similarity": null
      },
      "frozen": true,
      "left": {
        "image_key": "4020240147524.png"
      },
      "pair_id": "vp_0a92301c79f825dcec1c",
      "right": {
        "image_key": "4020240227309.png"
      },
      "split": "frozen_holdout"
    },
    {
      "annotation": {
        "annotator_id": null,
        "confidence": null,
        "notes": null,
        "visual_similarity": null
      },
      "frozen": false,
      "left": {
        "image_key": "4020220173357.png"
      },
      "pair_id": "vp_0b25102ac569ccf0e060",
      "right": {
        "image_key": "4020240239622.png"
      },
      "split": "dev"
    },
    {
      "annotation": {
        "annotator_id": null,
        "confidence": null,
        "notes": null,
        "visual_similarity": null
      },
      "frozen": false,
      "left": {
        "image_key": "4020230050697.png"
      },
      "pair_id": "vp_0c1cc00fe73f955eaa6d",
      "right": {
        "image_key": "4020230104392.png"
      },
      "split": "dev"
    },
    {
      "annotation": {
        "annotator_id": null,
        "confidence": null,
        "notes": null,
        "visual_similarity": null
      },
      "frozen": false,
      "left": {
        "image_key": "4020220164027.png"
      },
      "pair_id": "vp_0ca60c1cf7a08b40e4f1",
      "right": {
        "image_key": "4020250070435.png"
      },
      "split": "dev"
    },
    {
      "annotation": {
        "annotator_id": null,
        "confidence": null,
        "notes": null,
        "visual_similarity": null
      },
      "frozen": false,
      "left": {
        "image_key": "4020220164027.png"
      },
      "pair_id": "vp_0d35c55ebe1e0d93198d",
      "right": {
        "image_key": "4020220167439.png"
      },
      "split": "dev"
    },
    {
      "annotation": {
        "annotator_id": null,
        "confidence": null,
        "notes": null,
        "visual_similarity": null
      },
      "frozen": true,
      "left": {
        "image_key": "4020250020562.png"
      },
      "pair_id": "vp_0e5e23f7d9ec4b050893",
      "right": {
        "image_key": "4020260026077.png"
      },
      "split": "frozen_holdout"
    },
    {
      "annotation": {
        "annotator_id": null,
        "confidence": null,
        "notes": null,
        "visual_similarity": null
      },
      "frozen": false,
      "left": {
        "image_key": "4020230104392.png"
      },
      "pair_id": "vp_100dd11289b22e1180d9",
      "right": {
        "image_key": "4020260026077.png"
      },
      "split": "dev"
    },
    {
      "annotation": {
        "annotator_id": null,
        "confidence": null,
        "notes": null,
        "visual_similarity": null
      },
      "frozen": false,
      "left": {
        "image_key": "4020250133645.png"
      },
      "pair_id": "vp_10b462fb405085f9f186",
      "right": {
        "image_key": "4020250229515.png"
      },
      "split": "dev"
    },
    {
      "annotation": {
        "annotator_id": null,
        "confidence": null,
        "notes": null,
        "visual_similarity": null
      },
      "frozen": false,
      "left": {
        "image_key": "4020220173357.png"
      },
      "pair_id": "vp_13354d70cbba04d5ea02",
      "right": {
        "image_key": "4020250133645.png"
      },
      "split": "dev"
    },
    {
      "annotation": {
        "annotator_id": null,
        "confidence": null,
        "notes": null,
        "visual_similarity": null
      },
      "frozen": false,
      "left": {
        "image_key": "4020230104392.png"
      },
      "pair_id": "vp_14424f052000c1f293a2",
      "right": {
        "image_key": "4020240227309.png"
      },
      "split": "dev"
    },
    {
      "annotation": {
        "annotator_id": null,
        "confidence": null,
        "notes": null,
        "visual_similarity": null
      },
      "frozen": true,
      "left": {
        "image_key": "4020230088952.png"
      },
      "pair_id": "vp_151d8d579eb7dc51bb4a",
      "right": {
        "image_key": "4020240217822.png"
      },
      "split": "frozen_holdout"
    },
    {
      "annotation": {
        "annotator_id": null,
        "confidence": null,
        "notes": null,
        "visual_similarity": null
      },
      "frozen": false,
      "left": {
        "image_key": "4020240147524.png"
      },
      "pair_id": "vp_15bbbd6c9b578ec390fe",
      "right": {
        "image_key": "4020260026077.png"
      },
      "split": "dev"
    },
    {
      "annotation": {
        "annotator_id": null,
        "confidence": null,
        "notes": null,
        "visual_similarity": null
      },
      "frozen": false,
      "left": {
        "image_key": "4020230073832.png"
      },
      "pair_id": "vp_16b0430905d15bd3a0d2",
      "right": {